"Come down, O Christ, and help me! reach Thy hand,
For I am drowning in a stormier sea
Than Simon on Thy lake of Galilee:
The wine of life is spilt upon the sand,
My heart is as some famine-murdered land
Whence all good things have perished utterly,
And well I know my soul in Hell must lie
If I this night before God’s throne should stand.
‘He sleeps perchance, or rideth to the chase,
Like Baal, when his prophets howled that name
From morn to noon on Carmel’s smitten height.’
Nay, peace, I shall behold, before the night,
The feet of brass, the robe more white than flame,
The wounded hands, the weary human face."
"My heart is like a singing bird
Whose nest is in a watered shoot;
My heart is like an apple-tree
Whose boughs are bent with thick-set fruit;
My heart is like a rainbow shell
That paddles in a halcyon sea;
My heart is gladder than all these
Because my love is come to me.

Raise me a dais of silk and down;
Hang it with vair and purple dyes;
Carve it in doves and pomegranates,
And peacocks with a hundred eyes;
Work it in gold and silver grapes,
In leaves and silver fleurs-de-lys;
Because the birthday of my life
Is come, my love is come to me."
"Live all thy sweet life through
Sweet Rose, dew-sprent,
Drop down thine evening dew
To gather it anew
When day is bright:
I fancy thou wast meant
Chiefly to give delight.

Sing in the silent sky,
Glad soaring bird;
Sing out thy notes on high
To sunbeam straying by
Or passing cloud;
Heedless if thou art heard
Sing thy full song aloud.

O that it were with me
As with the flower;
Blooming on its own tree
For butterfly and bee
Its summer morns:
That I might bloom mine hour
A rose in spite of thorns.
O that my work were done
As birds' that soar
Rejoicing in the sun:
That when my time is run
And daylight too,
I so might rest once more
Cool with refreshing dew."
"I cannot tell you how it was;
But this I know: it came to pass
Upon a bright and breezy day
When May was young; ah, pleasant May!
As yet the poppies were not born
Between the blades of tender corn;
The last eggs had not hatched as yet,
Nor any bird foregone its mate.

I cannot tell you what it was;
But this I know: it did but pass.
It passed away with sunny May,
With all sweet things it passed away,
And left me old, and cold, and gray."
"Pardon the faults in me,
For the love of years ago:
Good by.
I must drift across the sea,
I must sink into the snow,
I must die.

You can bask in this sun,
You can drink wine, and eat:
Good by.
I must gird myself and run,
Though with unready feet:
I must die.

Blank sea to sail upon,
Cold bed to sleep in:
Good by.
While you clasp, I must be gone
For all your weeping:
I must die.

A kiss for one friend,
And a word for two,--
Good by:--
A lock that you must send,
A kindness you must do:
I must die.

Not a word for you,
Not a lock or kiss,
Good by.
We, one, must part in two:
Verily death is this:
I must die."
" ""A cup for hope!"" she said,
In springtime ere the bloom was old:
The crimson wine was poor and cold
By her mouth's richer red.

""A cup for love!"" how low,
How soft the words; and all the while
Her blush was rippling with a smile
Like summer after snow.

""A cup for memory!""
Cold cup that one must drain alone:
While autumn winds are up and moan
Across the barren sea.

Hope, memory, love:
Hope for fair morn, and love for day,
And memory for the evening gray
And solitary dove."
"Two days ago with dancing glancing hair,
With living lips and eyes:
Now pale, dumb, blind, she lies;
So pale, yet still so fair.

We have not left her yet, not yet alone;
But soon must leave her where
She will not miss our care,
Bone of our bone.

Weep not; O friends, we should not weep:
Our friend of friends lies full of rest;
No sorrow rankles in her breast,
Fallen fast asleep.

She sleeps below,
She wakes and laughs above;
To-day, as she walked, let us walk in love,
To-morrow follow so."
"Thou who didst hang upon a barren tree,
My God, for me;
Though I till now be barren, now at length,
Lord, give me strength
To bring forth fruit to Thee.

Thou who didst bear for me the crown of thorn,
Spitting and scorn;
Though I till now have put forth thorns, yet now
Strengthen me Thou
That better fruit be borne.

Thou Rose of Sharon, Cedar of broad roots,
Vine of sweet fruits,
Thou Lily of the vale with fadeless leaf,
Of thousands Chief,
Feed Thou my feeble shoots."
"If I might only love my God and die!
But now He bids me love Him and live on,
Now when the bloom of all my life is gone,
The pleasant half of life has quite gone by.
My tree of hope is lopped that spread so high,
And I forget how summer glowed and shone,
While autumn grips me with its fingers wan,
And frets me with its fitful windy sigh.
When autumn passes then must winter numb,
And winter may not pass a weary while,
But when it passes spring shall flower again:
And in that spring who weepeth now shall smile,
Yea, they shall wax who now are on the wane,
Yea, they shall sing for love when Christ shall come."
"The sweetest blossoms die.
And so it was that, going day by day
Unto the church to praise and pray,
And crossing the green churchyard thoughtfully,
I saw how on the graves the flowers
Shed their fresh leaves in showers,
And how their perfume rose up to the sky
Before it passed away.

The youngest blossoms die.
They die and fall and nourish the rich earth
From which they lately had their birth;
Sweet life, but sweeter death that passeth by
And is as though it had not been:--
All colors turn to green;
The bright hues vanish and the odors fly,
The grass hath lasting worth.

And youth and beauty die.
So be it, O my God, Thou God of truth:
Better than beauty and than youth
Are Saints and Angels, a glad company;
And Thou, O Lord, our Rest and Ease,
Art better far than these.
Why should we shrink from our full harvest? why
Prefer to glean with Ruth?"
"By day she wooes me, soft, exceeding fair:
But all night as the moon so changeth she;
Loathsome and foul with hideous leprosy,
And subtle serpents gliding in her hair.
By day she wooes me to the outer air,
Ripe fruits, sweet flowers, and full satiety:
But through the night, a beast she grins at me,
A very monster void of love and prayer.
By day she stands a lie: by night she stands,
In all the naked horror of the truth,
With pushing horns and clawed and clutching hands.
Is this a friend indeed; that I should sell
My soul to her, give her my life and youth,
Till my feet, cloven too, take hold on hell?"
"I dwelt alone
In a world of moan,
And my soul was a stagnant tide,
Till the fair and gentle Eulalie became my blushing bride–
Till the yellow-haired young Eulalie became my smiling bride.

Ah, less–less bright
The stars of the night
Than the eyes of the radiant girl!
And never a flake
That the vapour can make
With the moon-tints of purple and pearl,
Can vie with the modest Eulalie's most unregarded curl–
Can compare with the bright-eyed Eulalie’s most humble and careless curl.

Now doubt–now Pain
Come never again,
For her soul gives me sigh for sigh,
And all day long
Shines, bright and strong,
Astarté within the sky,
While ever to her dear Eulalie upturns her matron eye–
While ever to her young Eulalie upturns her violet eye."
"Thou wast all that to me, love,
For which my soul did pine–
A green isle in the sea, love,
A fountain and a shrine,
All wreathed with fairy fruits and flowers,
And all the flowers were mine.

Ah, dream to bright to last!
Ah, starry Hope! that didst arise
But to be overcast!
A voice from out the Future cries,
""On! on!""–but o'er the Past
(Dim gulf!) my spirit hovering lies
Mute, motionless, aghast!

For, alas! alas! with me
The light of Life is o'er!
""No more–no more–no more–""
(Such language holds the solemn sea
To the sands upon the shore)
Shall bloom the thunder-blasted tree
Or the stricken eagle soar!

And all my days are trances,
And all my nightly dreams
Are where thy grey eye glances,
And where thy footstep gleams–
In what ethereal dances,
By what eternal streams."
"Take this kiss upon the brow!
And, in parting from you now,
Thus much let me avow–
You are not wrong, who deem
That my days have been a dream;
Yet if hope has flown away
In a night, or in a day,
In a vision, or in none,
Is it therefore the less gone?
All that we see or seem
Is but a dream within a dream.

I stand amid the roar
Of a surf-tormented shore,
And I hold within my hand
Grains of the golden sand–
How few! yet how they creep
Through my fingers to the deep,
While I weep–while I weep!
O God! can I not grasp
Them with a tighter clasp?
O God! can I not save
One from the pitiless wave?
Is all that we see or seem
But a dream within a dream?"
"Beloved! amid the earnest woes
That crowd around my earthly path–
(Drear path, alas! where grows
Not even one lonely rose)–
My soul at least a solace hath
In dreams of thee, and therein knows
An Eden of bland repose.

And thus thy memory is to me
Like some enchanted far-off isle
In some tumultuous sea–
Some ocean throbbing far and free
With storms–but where meanwhile
Serenest skies continually
Just o'er that one bright island smile."
"Helen, thy beauty is to me
Like those Nicean barks of yore,
That gently, o'er a perfumed sea,
The weary, wayworn wanderer bore
To his own native shore.

On desperate seas long wont to roam,
Thy hyacinth hair, thy classic face,
Thy Naiad airs have brought me home
To the glory that was Greece,
And the grandeur that was Rome.

Lo! in yon brilliant window-niche
How statue-like I see thee stand,
The agate lamp within thy hand!
Ah, Psyche, from the regions which
Are Holy Land!"
"In spring of youth it was my lot
To haunt of the wide world a spot
The which I could not love the less–
So lovely was the loneliness
Of a wild lake, with black rock bound,
And the tall pines that towered around.

But when the Night had thrown her pall
Upon that spot, as upon all,
And the mystic wind went by
Murmuring in melody–
Then–ah then I would awake
To the terror of the lone lake
Yet that terror was not fright,
But a tremulous delight–
A feeling not the jewelled mine
Could teach or bribe me to define–
Nor Love–although the Love were thine.

Death was in that poisonous wave,
And in its gulf a fitting grave
For him who thence could solace bring
To his lone imagining–
Whose solitary sole could make
An Eden of that dim lake."
"The happiest day–the happiest hour
My sear'd and blighted heart hath known,
The highest hope of pride and power,
I feel hath flown.

Of power! said I? yes! such I ween;
But they have vanish'd long, alas!
The visions of my youth have been–
But let them pass.

And, pride, what have I now with thee?
Another brow may even inherit
The venom thou hast pour'd on me–
Be still, my spirit!

The happiest day–the happiest hour
Mine eyes shall see–have ever seen,
The brightest glance of pride and power,
I feel–have been:

But were that hope of pride and power
Now offer'd, with the pain
Even then I felt–that brightest hour
I would not live again:

For on its wing was dark alloy,
And, as it flutter'd–fell
An essence–powerful to destroy
A soul that knew it well."
"At morn–at noon–at twilight dim–
Maria! thou hast heard my hymn!
In joy and woe–in good and ill–
Mother of God, be with me still!
When the hours flew brightly by,
And not a cloud obscured the sky,
My soul, lest it should truant be,
Thy grace did guide to thine and thee;
Now, when storms of Fate o'ercast
Darkly my Present and my Past,
Let my Future radiant shine
With sweet hopes of thee and thine!"
"Twas noontide of summer,
And mid-time of night;
And stars in their orbits,
Shone pale, thro' the light
Of the brighter, cold moon,
'Mid planets her slaves,
Herself in the Heavens,
Her beam on the waves.
I gazed awhile
On her cold smile;
Too cold–too cold for me–
There pass'd, as a shroud,
A fleecy cloud,
And I turn'd away to thee,
Proud Evening Star,
In thy glory afar,
And dearer thy beam shall be;
For joy to my heart
Is the proud part
Thou bearest in Heaven at night,
And more I admire
Thy distant fire,
Than that colder, lowly light."
"I saw thee on thy bridal day–
When a burning blush came o'er thee,
Though happiness around thee lay,
The world all love before thee:

And in thine eye a kindling light
(Whatever it might be)
Was all on Earth my aching sight
Of Loveliness could see.

That blush, perhaps, was maiden shame–
As such it well may pass–
Though its glow hath raised a fiercer flame
In the breast of him, alas!

Who saw thee on that bridal day,
When that deep blush would come o'er thee,
Though happiness around thee lay;
The world all love before thee."
"Se lauloi sininen lintu: »Ihmis-, ihmiskullat, kuinka teiss' on tuhma tieto autuudesta elon!
Kuinka nousta nuori kukka voisi vanhan mieleen, suven henki heilimöidä syksyisessä puussa?
Suljettu on suuri onni, taivas kiinni hälle, jok' ei lapsen lailla tule Terhensaaren linnaan.
Lähtehessä kylpekäätte kuusikummun alla, virran vienon paaterella päivää paistatelkaa.
Murhemuistot entisyyden tuonne kaikki jääkööt, tuskat öitten tummien ja hikihelmet päiväin.
Elo niinkuin ensi kerran silmillänne nähkää, kun ei huolta huomenkoiton eikä eilis-ehtoon.
Maan ei liene mahtajille Terhenlinna tehty, tehty vain on tulla niiden, joill' on unhon lahja;
joill' on kyky kummastella, ilo ihmetellä, usko aina uudistua, toivo toinen olla.»"
"Leikkiä lyöden
sun luoksesi tulin,
mutta mä murheesi
hehkuhun sulin.

Nyt olet iloinen,
nyt olet vapaa,
enkä mä tummaa
neittäni tapaa.

Antanut oon
ilon päärlyn mä sulle.
Miksi et murheesi
huntua mulle?

Haihtui huntu,
kun itse sa haihduit.
Vaihduin, kun itse
sa valkeaks vaihduit.

Jälleen nään
sinut entisin silmin,
naljaillen nauran
ma lempeni ilmi.

Menneet on iltani
itkun ja huolen.
Leikkiä lyöden
sun eteesi kuolen."
"Jälkeen aamu-usmien järvi hopeoituu, päivätönnä päilyen koreaksi koituu.
Kuvastelee koivu, kuus, rannan viita viilee, kummallinen hiljaisuus syvyydessä piilee.
Sadekuurot kulkevat kaukaa siellä täällä, käy kuin aallon unelmat virit vetten päällä.
Harras niinkuin ystävän taivahan on tuntu, vaihtuva kuin elämän kaukometsän huntu.
Sataa munkin mielehein hopeainen seule, kaartuu kautta aatostein samettinen neule.
Niinpä hunnun alle jään, sillä peitän pääni, uskon yhteen ystävään, yhteen elämääni."
"Ja jos vähän mulla vain aikaa on, mun mieleni kaari on mittaamaton, taas riennän ma riemuun ja huoleen; ovat kauniita Kukkian päivät ja yöt, mut kauniimmat vaativat ihmisten työt mua myrskyn ja maailman puoleen.
Levon lempeän lapset ei muistele mua, mut kuitenkin, Kukkia, siunaan ma sua, jos tartunkin sauvaan ja viittaan; menen matkaani hattua heilauttain, kun säilyi mun sieluni vapaus ain, vähät muusta ma maan päällä piittaan.
Voin kuiskata sentään: jo orjasi olin, kun, Kukkia, saartesi kumpuja polin, elinkautinen valtasi vanki; mut aamu kun koitti, se armahti lastaan, sain voiman ma taistella rauhaani vastaan, näin voittaen vaikeimmanki.
Oli tenhoa ilmassa, tiesin ma sen, mut ett' ero oisi niin tuskallinen, ei arvata saattanut kukaan; ma pelkään, sun öin sekä päivin ma nään, mut ennen kuin loihtusi lankahan jään, vien kultaiset muistoni mukaan."
"Kimmelsi kiteet, miekkoina iskivät mielipiteet, välkkyi aattehen ankara teräs, nukkuva nousi, hengetön heräs, kasvoivat kansat jo oikeutta kohti, kullakin vapaus tähtenä hohti.
Niin silloin tulikin Surma.
Välkähti rauta, aukesi myös monen aattehen hauta, haihtuivat ilmahan tuulien tuvat, lempeät haaveet, kaunihit kuvat; taas oli taivas kirkas ja seijas, kuoleman henki vain kummuilla leijas.
Kimmelsi kiteet."
"Sain ma siivet aurinkoon, itse ilman herra oon, ukkoselta vaajat vienen; jumalaksi luotu lienen.
Minkä tahdon, sen ma voin: päiden päällä salamoin, isken maihin ihmisien, katot särjen kaupunkien.
Suitsen surmaa helmastain, tapan, ketä tahdon vain, aseellista, aseetonta– niitä jo ma niitin monta.
Vuosisatain unelman, toivon pitkän toteutan, niinkuin lintu lennän, liidän, kimppuun ihmiskunnan kiidän.
Kunniaani laulakaa kaikki kansat, kaikki maa, kiitostani veisatkaatte, silloin tekin siivet saatte!"
"Suvi-illan vieno tuuli huokaa vuoren alta, hongikon polkua hopeoipi kuuhut taivahalta.
Hiljaa huojuu korven honka, kaukana käkö kukkuu, vaieten astuvi vaeltaja, mielen murhe nukkuu."
"Paista, päivä, köyhän päivä, paista päälle päivän lapsen, siniviitojen välitse; paistat päälle yönkin poian, halki mielen hallaisenki, keltalehtien lomitse.
Paista päivä, suuri päivä, paista suurta sunnuntaita saarelle suven ijäisen; paistat työnkin paahtajalle, elon arki-askareihin, joista voimani väsähti.
Paista, päivä, lämmin päivä, paista mulle, paista muille, koko kylmälle kylälle; anna mulle uusi usko, muille armas aamurusko, enin orjille elämän."
"Tiedän, tiedän, mielitietty, miksi luotain läksit pois: kova, kolkko, lämmin, vieno kuinka yhteen soida vois?
Sentään tässä sydämessä asuu itse aurinko, vaikka pohjan pilvet, hallat kaihti siltä kasvot jo.
Voi en kantaa kämmenellä enää esiin sydäntäin, piilotan sen sinne, missä mietin ypö-yksinäin.
Liekö lemmen aika mennyt, kosk' en vihata ma voi, vaiko tuska valkeaksi muinen tumman mielen loi?
Paistan yhteis-ymmärrystä yli kaiken kauniin maan, elon ulkopuolla itse, elämää luon maailmaan.
Taikka jos ma vielä virkan: elän, vaikk' en entinen, elän tähtein tuollapuolla, tunnen kauhut tyhjyyden.
Mutta myöskin riemut, hurmat, joist' ei tähdet tietää voi: heill' on pakkokierto, mulla vapaus, jonka taisto toi."
"Voi meitä, voi!
Tuossa taaton, tuossa veljen
verta hanki joi.

Voi meitä orpoja,
voi meitä kurjia,
voi vihan päiviä,
päättömiä, hurjia!

Kolme kertaa poltettihin,
kolme kertaa nousi,
tuhkastansa taaton pirtti,
joikui kirves, jousi.

Voi meitä, voi meitä!
Talvi-ilta lankee,
kiihtyy pohjan pakkanen,
on eessä kuolo ankee.

Voi, tuolla jo tulevat taas!
Uusi kurjuus!
Kuoloakin ankaramp' on
orjuus, on orjuus!

Voi meitä, voi teitä
kotilemmen, kotilieden
koidon ryöväreitä!"
"Kerta seisoin, niin näin unta,
Meren reunal vieraas maas;
Etääl siinti koti-ranta,
Sinne mielin tulla taas.

Mutta uni, joka ensin
Vei mun maastain, immestäin,
Hänen siivillänsä lensin
Jälleen koti-maahan päin.

Siirsin mielel intovalla
Pojes Suomeen ihanaan,
Siirsin vinhast pilvein alla,
Siks kuin löysin kunnasmaan.

Tuima tuuli pilvet poisti,
Kaunis päivä paisto taas;
Vuori loisti, viita loisti,
Koski pauhas koti-maas.

Impein eteheeni väikky:
Silmä iski salamoi,
Kiharien yössä läikky
Otsa niinkuin aamun koi.

Ihastelin otsan aamuu,
Mesi-huulii suutelin.
Suutelinko taivon haamuu?
Hekumasta heräsin."
"Kuin käden vienon viileys
saa kulmilleni mun,
kuin häive, huntu, ilmestys
maan oudon, salatun.
Ah tunnenhan, ah tunnenhan
ma, Sumuneiti, sun!

Yön rimpi olen rauhaton,
yön kuningatar sa,
sun kruunus liljankukka on,
ties niitun untuva.
 Oi valtiatar varjon maan,
mua raukkaa rakasta!

On viittas unta viherää
ja silmäsi kuin suo.
Ma tuoksus tunnen, vaikk' en nää,
sun suutas suuni juo.
Ah, sallithan, ah sallithan
mun jäädä yötä luo!

Sun lempes yllein lankeaa
kasteisin pisaroin.
 Näin kyynelees mua armastaa
valveeseen aamun koin.
Yölintuna sun povellas
ma kaikertelen, soin…"
"Helisen, helisen myötä ilman tuulien, tuuliharppu-sielujen.
Valaisen, valaisen iltaa iloliekkien, kirmaa ilokeijujen.
Kuuntelen, kuuntelen nyyhkytystä sydänten, katkenneiden hermojen.
Katselen, katselen pisarointaa hetkien ikuisuuden merehen."
"Taukoomatta saatto seppelpäinen tästä rientää soiton tahtiin pikaan, thyrsus-sauvoin, jumalien lailla, niinkuin kuolemaa ei olisikaan.
Tuonne sortuu ne kuin vierinkivet, sielut raskaat, liepehiltä hälyn maantien viereen salakuorminensa pettäminä sydämen ja älyn.
Hetken sinkoo leikin sininuoli, palaa taideteon taivaankaari. Ihmisrinta himoaa ja hiiltyy, katoaa kuin kangastava saari."
"Yli puiden latvain ja kattojen kaukaisten pois käy yövartija kuu.
On kuollut hetki. Yötuikkujen luomet kiinn' ummistuu.
Sarasteen sormi talorivien ruutuja hipsii hereilleen. Sumuniljakkaina kuin satimess' aaveet ne katsovat taivaaseen.
Ui kelmeä kuura sinivehreenä Lethenä huuhtoin parmaita maan. Yön hiilitytti, jäätähtien prinsessa, on arkussaan."
"Harsolla surun mun silmäni soasta ryövärit taisi, etten ma ryöväriteittensä loasta tietoa saisi.
Kuulen: he vierivät verisestä sodasta ratsain ja jalan… Kuiskasi kuu mulle kurjuuden kodasta kauhean salan.
Siedä en, vaikk' olen vanki ja sokea, valheen paulaa. Laulan, kuin vierressä Tuonelan jokea lastuset laulaa."
"Kuu kattojen harjoilla kimmeltää.
Yön hermot on seittiä lukin.
Himon pantteri nälkähän havahtuu
ja hiipii silkkisin sukin…

Kuu kattojen harjoilla kimmeltää.
Nyt aika on saalin-ajon.
Lyö silmien hiilet vastakkain
polun hiekalle heittäen kajon.

Kuu kattojen harjoilla kimmeltää. Tuli silmien veitsenä viiltyy läpi seinän, kammioon hulmahtaa, ja valkeat linnat hiiltyy."
"Kajahtaa kauas kalske vasaroiden, joit' oman onnen sepät heiluttaa. Maa versoo, lahjoin lepytettiin maa ja verin pestiin posket omenoiden.
Mut kaikk' on tyhjää virvaa päällä soiden, suonsilmään sairaaseen kaikk' katoaa. Tääll onni kaunein madonsyömän saa ja murtuu vastus sotahaarniskoiden.
Kaikk' kimallust' on kuolleen kultakalan. Ma yksin sortumistas soimaan jään ja kerran julki saatan muistos salan:
tarinan kohtalosta kansan tään, mi potkupalloksensa syöksi pään ja sydämeensä päästi väärän valan."
"Inferno kiehuu, uumenet luonnon loimuaa, riehuu, rikkiä, tuhkaa tupruaa, sataa. Miljoona noitaa kattilaa hoitaa, Helvetin pataa.
»Häijy on kaunis, kaunis on häijy!» Soi punanauru raivotartahti henkien raakain. Käy salaväijy, lahjonta heikkoin, väärennys vaakain. Äijän on äimeet peijahat peikkoin, herkkuna veikkoin, raadeltu liha, valhe ja viha!
Noitien jalkaa karkelo nostaa. Raivotar-ruojain, hurmehen-juojain yltyvi piirin vinkuna vinha: »Ihminen inha tahtovi nousta alusta alkaa. Kirous hälle! Kuolema päivään kerkeävälle! Alas! Alas! Alkuyön kaaos helmaamme palas!»
Inferno kiehuu, uumenet luonnon loimuaa, riehuu, rikkiä, tuhkaa tupruaa, sataa. Miljoona noitaa kattilaa hoitaa, Helvetin pataa!"
"Tuijotan, tuijotan tuntehitta sakeaan syksyn sumuun… Kaikki ne jäljettä vaipuvat sinne, hukkuvat hetken humuun.
Kantelen, kantelen silmissäni kuvia kalman ja kauhun. Vonkuvi lasinen kupuni yössä ylitse aaltojen pauhun.
Lepatan, lepatan aatosta vailla majakkavilkkuna meren. Uittelen ulapan viileään rauhaan kuohuja kiihkeän veren."
"Yöt' en enää toista kestä! Syvyys tyyni, tiedät syyni: säikeet poikki sydämestä!
Mustan virran viekas valta, nukuttava, hukuttava, kumpi väistyy kumman alta?
Mustan virran viekas loihtu, huuteleva, suuteleva. Herra, heitä yöhön soihtu!
Tuli, tähti, merkki pieni, että olet, että elät, taikka tähän päättyy tieni!"
"Ma piilipuitten alta löysin sydänystäväin.
Hän kulki piilipuitten alla lumiliinapäin.
Hän halas, ett' ois rakkautemme kevyt lehti vain.
Vaan olin lapsellinen enkä käsittänyt lain.

Ja kun me virran kaltaalla taas käytiin kahdestaan,
hän koski lumikädellään mua olkaan kumaraan.
Hän halas, ett' ois elämämme kevyt kukkanen.
Vaan olin lapsellinen, kuljin sydän itkien."
"Nauroitko?
Kuulin varmasti kolkutusta puoliyön hetkellä,
arkaa, kuin joku ensi kerran
olisi kolkuttanut.

Ehkä joku toivoton nuorukainen,
joka oli sinuun rakastunut, Gretchen,
sinun valkoiseen hipiääsi,
jossa ei ole yhtään ihojauhetta.

Moni voi sinulle sanoa aivan turhia sanoja. Minä en. Sillä minä itse kolkutin sydämesi ovella."
"Se on eriskummallinen lintu, joka
ei ole kokonaan lintu. Mutta se
istuu kaukaisessa viheriäisessä
metsässä kaukaisen vaskivuoren
takana ja vartioitsee aarteita.
Sinä et voi nähdä sitä, oi
Duryodhana, mutta sen äänen
kuulet hiljaisina iltoina. Mutta
kun vaakalinnun äänen kuulet,
vyötä silloin kupeesi, oi
Duryodhana, ja kätkeydy, sillä
onni on saita."
"Armas, sun kiharoissasi liehtoi suvinen tuuli, kun sinut tapasin viileessä toukokuussa vuokkojen kukkimisaikaan, sunnuntaina auringonläikkeessä Ruissalon rantatiellä.

Armas, näin, miten korvies pienet helmet
mustien hiustesi varjoon piiloittuivat,
sitten näin sinun silmäs, ja niitten kaivoon
upposi äkkiä sieluni jääden sinne.

Tammien alla me kuljimme iltaan asti.
Kuulimme peipposlintujen suloisen laulun.
Nousimme vuorille. Toukomettisen huilu
helähti laaksosta, miltei jalkaimme alta.

Poimimme alhosta vuokkoja silloin tällöin
ujoina, arkoina toistemme silmiä etsein.
Olimme hartaita. Turusta kuljetti tuuli
tuomiokirkosta suurien kellojen pauhun.

Itkimme melkein. Olimme onnellisia.
Silloin me kuulimme metsästä tumman soinnun:
kaukana jossain, oksien holviston alla
outo lintu valitti kummallisesti…"
"Tulipunainen aurinko vavahti äkkiä palamaan. Minä unestani havahduin enkä noussut kumminkaan.

Minun ikkunani edessä
oli koivu kultainen.
Sen oksalta kuulin linnun
alakuloisen.

Minä uneksin hetken vielä:
näin prinsessan kumartuvan
ja suovan kerjuripojalle
jäähyväissuudelman.

Minun herätyskelloni soitti.
Minun oli mentävä nyt.
Tätä syksyaamua ajatellen
olin monesti värissyt."
