"Jeg gaar imellem ranke, nakne stammer.
De blanke knopper løfter sig i lyset ind
og drikker graadig aftensolens skin,
som lavt paa vaarens bleke himmel flammer.

De milde vinde stryker mine hænder,
og lykken skjælver dypest i mit hjerte
– den skjønne jord og livets tændte kjerte,
som klar i denne klare vaarkveld brænder.

Jeg knæler i din kirke, nakne skog.
Aa muld, aa sol, aa fagre livets ord:
Jeg er av jord, skal atter bli til jord,
og al min sjæl er fuld av jordens lov! 

Og hil dig, hil dig, jordens moderskjød,
og muldens friske duft mot himlens bue,
kastanjetræets knoppers alterlue,
og hil dig, hil dig, sterke herre død!

For dobbelt blaa sigjVaarens himmel hvælver
og dobbelt fager synker sol i sjø,
fordi imorgen skal vi kanske dø,
og angsten gjennem jubelsangen skjærer. "
"Ingen tør jeg at klandre
blev ensom min sjæl.
Er der en mur mellem mig og de andre
bygget jeg den selv.

Er der ingen, mig kjender
– jeg vilde det vel saa.
Der var vel møtt de hjerter og hænder,
som jeg kunde naa.

Ingen blir svigtet av livet
– nu vet jeg det vel,
som uten svik har givet
det liv og sjæl. "
"O, jeg har mer end elsket dig,
for jeg har hat dig hjertens kjær
i dage og i aar,
– men elskov kommer hastelig,
og hastelig den gaar.

Du elsket mig – som dyrt du svor
Jeg tok ei feil, som trodde dig
– for hver en ed, du brød.
Jeg trodde ikke dine ord
men dine læbers glød.

Og nu, som du har sveget mig
– nu er jeg rolig, som jeg alt
laa gjemt i jordens skjød.
I moders hus paa alfar vei
– jeg gaar der som en død. "
"Jeg saa ikveld dit ansigt, evighet.
Med lukte vinger hvilte høstens vind
blandt gulnet aspeløv –, et purpurskin
faldt over aaserne, da sol gik ned.
Nu kommer natten, kold og fuld av fred,
med tusen løvfalds hilsen til mit sind.
Som lys og varme dør med solens skin
forsvinder vi. Men livet varer ved.

Og dog vort liv kan evigheten rumme.
I kval og lyst, – naar tiden stille staar,
den skjænkes os av nattens lapiskumme.
– Ifald din skjæbne vil det, skal du kjende
de dage, hvorav en er tusen aar,
og nætterne, der synes uten ende. "
"Et navn, som var vort liv engang,
og siden som et blodig saar
i sindet – og saa aar for aar
som mindet om en sluknet sang.

Og livet glir – og aar for aar
i tomt og taushet dør den hen.
– En dag saa blir det kanske vaar
og se – vort liv er liv igjen.

Da hænds det – i en drømmestund
vi minds – blandt nye toners klang,
med skjælv av nye smil om mund
et navn, som var vort liv engang.

Vi ser – som paa et vissent blad,
vor ungdoms yndlingsbok har gjemt
til minde om en sommerdag,
hvis duft og farver længst er glemt. "
"Livet har vist budt mig gaver
som jeg ikke tok imot –.
Jeg blev bedt, og jeg blev lovet
– det var jeg, som ei forstod.

Var det slik, jeg kom til maalet
gik forbi og ikke saa det?
Jeg har gaat for langt og længe,
og nu kan jeg ikke naa det.

Er det mørkt, fordi jeg ikke
flammen paa min lampe nærte
Fryser jeg, fordi jeg bærer
kulden i mit eget hjerte – ? "
"Det Første bitre ord var talt
imellem dig og mig;
vi fulgtes tause samme vei,
– vi gik og angret alt.
Og trist jeg stirret like frem,
– da knitret det i veiens støv –
som slæpte jeg min kjoles brem
henover vissent lov.

Men guldregn blomstret, og syrin,
i parken, hvor vi gik,
og junidagens soldis fik
en vellugt, het og tung som vin.
Utover plænens blomsterpragt
gik hvite sommerFugles flugt,
og det, som knitret i min dragt,
var almetræets vingefrugt.

Høit op i himlens klare bund
drev hvite skyfnugg, bitte smaa.
– Jeg løftet øiet mot det blaa –
da kysset du min mund.
Og skjønt jeg først stred litt imot,
var snart vor første trætte glemt.
Men dypest i min hjerterot
sat der en liten kulde gjemt.

Og da det sidste bitre ord
var skiftet mellem dig og mig,
og harm og saar jeg gik min vei,
da raslet paa den frosne jord
det visne lov i tætte lag;
der steg en skarp og syrlig lugt.
– Da mindtes jeg den junidag
og almetræets frugt. "
"Laurentii taarers tid – og over himlen
drysser i disse nætter stjerneskud,
og fra mit vindu passer jeg paa vrimlen,
for med hver stjerne skal jeg sende bud.

Aar efter aar jeg ønsket med hver stjerne.
Nu, for mig seiv jeg ønsker ikke mer;
hver haabløs bøn jeg sendte mot det fjerne
er opfyldt nu – jeg sender ingen fler

for mig – men over byens mørke take
jeg speider mot Laurentii taarers væld
og ønsker med hvert stjerneskud, og har tilbake
ti tusen ønsker for en anden en ikveld.

Og saa jeg alle himlens stjerner falde,
og naadde jeg at ønske med dem hver og en,
saa fik jeg endda ikke ønsket alle
mit hjertes ønsker for min egen ven. "
"God paa sin vis
maa kver verda funnen.
Aldri eg fann
nokon syndig i grunnen.
God paa sin vis
vist kver ein maa vera.
Naud maa der til,
nåar vondt han skal gjera.
Kver paa sin vis
si sæla vil vinna,
altid han leitar,
men sjeldan kann finna.
Den, som med hat
fraa livet seg vende,
livet til gagns
rett aldri han kjende. "
"Solveig.
Lig fjorden, som stille i maaneskin drømmer,
ung Solveiges mørkeblaa øie det svømmer
i taarer. Og hjertet det banker
af ømhed og længsel,
lig bølgen mod kyst
misunder i fængsel
de frifødte tanker,
som fløi til den elskedes bryst.

Ved stranden bun lytter; men natten gjenlyder
saa fjernt ud fra havet, som larmer og bryder
mod skjæret. En havfrue synger
der ude sin smerte
med smeltende klang.
Naar længselen tynger
for tungt paa et hjerte,
det elsker en sorrigfuld sang.

Ak, vidste du Solveig, hvad havfruen synger!
Det knager fra furrenes natsorte klynger
lig sukke. En gut her fra fjorde
hun fulgte saa vide
med elskov paa sjø.
Men syd under lide
de rydded hans borde,
nu maa hun i havskummet dø. "
