"One’s-self I sing, a simple separate person,
Yet utter the word Democratic, the word En-Masse.

Of physiology from top to toe I sing,
Not physiognomy alone nor brain alone is worthy for the Muse, I say
the Form complete is worthier far,
The Female equally with the Male I sing.

Of Life immense in passion, pulse, and power,
Cheerful, for freest action form’d under the laws divine,
The Modern Man I sing."
"As I ponder’d in silence,
Returning upon my poems, considering, lingering long,
A Phantom arose before me with distrustful aspect,
Terrible in beauty, age, and power,
The genius of poets of old lands,
As to me directing like flame its eyes,
With finger pointing to many immortal songs,
And menacing voice, What singest thou? it said,
Know’st thou not there is but one theme for ever-enduring bards?
And that is the theme of War, the fortune of battles,
The making of perfect soldiers.

Be it so, then I answer’d,
I too haughty Shade also sing war, and a longer and greater one than any,
Waged in my book with varying fortune, with flight, advance
and retreat, victory deferr’d and wavering,
(Yet methinks certain, or as good as certain, at the last,) the
field the world,
For life and death, for the Body and for the eternal Soul,
Lo, I too am come, chanting the chant of battles,
I above all promote brave soldiers."
"In cabin’d ships at sea,
The boundless blue on every side expanding,
With whistling winds and music of the waves, the large imperious waves,
Or some lone bark buoy’d on the dense marine,
Where joyous full of faith, spreading white sails,
She cleaves the ether mid the sparkle and the foam of day, or under
many a star at night,
By sailors young and old haply will I, a reminiscence of the land, be read,
In full rapport at last.

Here are our thoughts, voyagers’ thoughts,
Here not the land, firm land, alone appears, may then by them be said,
The sky o’erarches here, we feel the undulating deck beneath our feet,
We feel the long pulsation, ebb and flow of endless motion,
The tones of unseen mystery, the vague and vast suggestions of the
briny world, the liquid-flowing syllables,
The perfume, the faint creaking of the cordage, the melancholy rhythm,
The boundless vista and the horizon far and dim are all here,
And this is ocean’s poem.

Then falter not O book, fulfil your destiny,
You not a reminiscence of the land alone,
You too as a lone bark cleaving the ether, purpos’d I know not
whither, yet ever full of faith,
Consort to every ship that sails, sail you!
Bear forth to them folded my love, (dear mariners, for you I fold it
here in every leaf;)
Speed on my book! spread your white sails my little bark athwart the
imperious waves,
Chant on, sail on, bear o’er the boundless blue from me to every sea,
This song for mariners and all their ships."
"You who celebrate bygones,
Who have explored the outward, the surfaces of the races, the life
that has exhibited itself,
Who have treated of man as the creature of politics, aggregates,
rulers and priests,
I, habitan of the Alleghanies, treating of him as he is in himself
in his own rights,
Pressing the pulse of the life that has seldom exhibited itself,
(the great pride of man in himself,)
Chanter of Personality, outlining what is yet to be,
I project the history of the future."
"To thee old cause!
Thou peerless, passionate, good cause,
Thou stern, remorseless, sweet idea,
Deathless throughout the ages, races, lands,
After a strange sad war, great war for thee,
(I think all war through time was really fought, and ever will be
really fought, for thee,)
These chants for thee, the eternal march of thee.

(A war O soldiers not for itself alone,
Far, far more stood silently waiting behind, now to advance in this book.)

Thou orb of many orbs!
Thou seething principle! thou well-kept, latent germ! thou centre!
Around the idea of thee the war revolving,
With all its angry and vehement play of causes,
(With vast results to come for thrice a thousand years,)
These recitatives for thee,–my book and the war are one,
Merged in its spirit I and mine, as the contest hinged on thee,
As a wheel on its axis turns, this book unwitting to itself,
Around the idea of thee."
"When I read the book, the biography famous,
And is this then (said I) what the author calls a man’s life?
And so will some one when I am dead and gone write my life?
(As if any man really knew aught of my life,
Why even I myself I often think know little or nothing of my real life,
Only a few hints, a few diffused faint clews and indirections
I seek for my own use to trace out here.)"
"Beginning my studies the first step pleas’d me so much,
The mere fact consciousness, these forms, the power of motion,
The least insect or animal, the senses, eyesight, love,
The first step I say awed me and pleas’d me so much,
I have hardly gone and hardly wish’d to go any farther,
But stop and loiter all the time to sing it in ecstatic songs."
"How they are provided for upon the earth, (appearing at intervals,)
How dear and dreadful they are to the earth,
How they inure to themselves as much as to any–what a paradox
appears their age,
How people respond to them, yet know them not,
How there is something relentless in their fate all times,
How all times mischoose the objects of their adulation and reward,
And how the same inexorable price must still be paid for the same
great purchase."
"To the States or any one of them, or any city of the States, Resist
much, obey little,
Once unquestioning obedience, once fully enslaved,
Once fully enslaved, no nation, state, city of this earth, ever
afterward resumes its liberty."
"Here, take this gift,
I was reserving it for some hero, speaker, or general,
One who should serve the good old cause, the great idea, the
progress and freedom of the race,
Some brave confronter of despots, some daring rebel;
But I see that what I was reserving belongs to you just as much as to any."
"Success is counted sweetest
By those who ne'er succeed.
To comprehend a nectar
Requires sorest need.

Not one of all the purple host
Who took the flag to-day
Can tell the definition,
So clear, of victory,

As he, defeated, dying,
On whose forbidden ear
The distant strains of triumph
Break, agonized and clear!"
"Our share of night to bear,
Our share of morning,
Our blank in bliss to fill,
Our blank in scorning.

Here a star, and there a star,
Some lose their way.
Here a mist, and there a mist,
Afterwards – day!"
"Soul, wilt thou toss again?
By just such a hazard
Hundreds have lost, indeed,
But tens have won an all.

Angels' breathless ballot
Lingers to record thee;
Imps in eager caucus
Raffle for my soul."
"T is so much joy! 'T is so much joy!
If I should fail, what poverty!
And yet, as poor as I
Have ventured all upon a throw;
Have gained! Yes! Hesitated so
This side the victory!

Life is but life, and death but death!
Bliss is but bliss, and breath but breath!
And if, indeed, I fail,
At least to know the worst is sweet.
Defeat means nothing but defeat,
No drearier can prevail!

And if I gain, – oh, gun at sea,
Oh, bells that in the steeples be,
At first repeat it slow!
For heaven is a different thing
Conjectured, and waked sudden in,
And might o'erwhelm me so!"
"Glee! The great storm is over!
Four have recovered the land;
Forty gone down together
Into the boiling sand.

Ring, for the scant salvation!
Toll, for the bonnie souls, –
Neighbor and friend and bridegroom,
Spinning upon the shoals!

How they will tell the shipwreck
When winter shakes the door,
Till the children ask, ""But the forty?
Did they come back no more?""

Then a silence suffuses the story,
And a softness the teller's eye;
And the children no further question,
And only the waves reply."
"If I can stop one heart from breaking,
I shall not live in vain;
If I can ease one life the aching,
Or cool one pain,
Or help one fainting robin
Unto his nest again,
I shall not live in vain."
"Within my reach!
I could have touched!
I might have chanced that way!
Soft sauntered through the village,
Sauntered as soft away!
So unsuspected violets
Within the fields lie low,
Too late for striving fingers
That passed, an hour ago."
"A wounded deer leaps highest,
I've heard the hunter tell;
'T is but the ecstasy of death,
And then the brake is still.

The smitten rock that gushes,
The trampled steel that springs;
A cheek is always redder
Just where the hectic stings!

Mirth is the mail of anguish,
In which it cautions arm,
Lest anybody spy the blood
And ""You're hurt"" exclaim!"
"The heart asks pleasure first,
And then, excuse from pain;
And then, those little anodynes
That deaden suffering;

And then, to go to sleep;
And then, if it should be
The will of its Inquisitor,
The liberty to die."
"A precious, mouldering pleasure 't is
To meet an antique book,
In just the dress his century wore;
A privilege, I think,

His venerable hand to take,
And warming in our own,
A passage back, or two, to make
To times when he was young.

His quaint opinions to inspect,
His knowledge to unfold
On what concerns our mutual mind,
The literature of old;

What interested scholars most,
What competitions ran
When Plato was a certainty.
And Sophocles a man;

When Sappho was a living girl,
And Beatrice wore
The gown that Dante deified.
Facts, centuries before,

He traverses familiar,
As one should come to town
And tell you all your dreams were true;
He lived where dreams were sown.

His presence is enchantment,
You beg him not to go;
Old volumes shake their vellum heads
And tantalize, just so."
"On, on the vessel flies, the land is gone,
And winds are rude in Biscay's sleepless bay.
Four days are sped, but with the fifth, anon,
New shores descried make every bosom gay;
And Cintra's mountain greets them on their way,
And Tagus dashing onward to the deep,
His fabled golden tribute bent to pay;
And soon on board the Lusian pilots leap,
And steer 'twixt fertile shores where yet few rustics reap."
"Oh, Christ! it is a goodly sight to see
What Heaven hath done for this delicious land!
What fruits of fragrance blush on every tree!
What goodly prospects o'er the hills expand!
But man would mar them with an impious hand:
And when the Almighty lifts his fiercest scourge
'Gainst those who most transgress his high command,
With treble vengeance will his hot shafts urge
Gaul's locust host, and earth from fellest foemen purge."
"What beauties doth Lisboa first unfold!
Her image floating on that noble tide,
Which poets vainly pave with sands of gold,
But now whereon a thousand keels did ride
Of mighty strength, since Albion was allied,
And to the Lusians did her aid afford
A nation swoll'n with ignorance and pride,
Who lick, yet loathe, the hand that waves the sword.
To save them from the wrath of Gaul's unsparing lord."
"But whoso entereth within this town,
That, sheening far, celestial seems to be,
Disconsolate will wander up and down,
Mid many things unsightly to strange e'e;
For hut and palace show like filthily;
The dingy denizens are reared in dirt;
No personage of high or mean degree
Doth care for cleanness of surtout or shirt,
Though shent with Egypt's plague, unkempt, unwashed, unhurt."
"Poor, paltry slaves! yet born midst noblest scenes–
Why, Nature, waste thy wonders on such men?
Lo! Cintra's glorious Eden intervenes
In variegated maze of mount and glen.
Ah me! what hand can pencil guide, or pen,
To follow half on which the eye dilates
Through views more dazzling unto mortal ken
Than those whereof such things the bard relates,
Who to the awe-struck world unlocked Elysium's gates?"
"The horrid crags, by toppling convent crowned,
The cork-trees hoar that clothe the shaggy steep,
The mountain moss by scorching skies imbrowned,
The sunken glen, whose sunless shrubs must weep,
The tender azure of the unruffled deep,
The orange tints that gild the greenest bough,
The torrents that from cliff to valley leap,
The vine on high, the willow branch below,
Mixed in one mighty scene, with varied beauty glow."
"Then slowly climb the many-winding way,
And frequent turn to linger as you go,
From loftier rocks new loveliness survey,
And rest ye at 'Our Lady's House of Woe;'
Where frugal monks their little relics show,
And sundry legends to the stranger tell:
Here impious men have punished been; and lo,
Deep in yon cave Honorius long did dwell,
In hope to merit Heaven by making earth a Hell."
"On sloping mounds, or in the vale beneath,
Are domes where whilom kings did make repair;
But now the wild flowers round them only breathe:
Yet ruined splendour still is lingering there.
And yonder towers the prince's palace fair:
There thou, too, Vathek! England's wealthiest son,
Once formed thy Paradise, as not aware
When wanton Wealth her mightiest deeds hath done,
Meek Peace voluptuous lures was ever wont to shun."
"There is a tomb in Arqua;–reared in air,
Pillared in their sarcophagus, repose
The bones of Laura's lover:here repair
Many familiar with his well-sung woes,
The pilgrims of his genius.He arose
To raise a language, and his land reclaim
From the dull yoke of her barbaric foes:
Watering the tree which bears his lady's name
With his melodious tears, he gave himself to fame."
"For time hath not rebuilt them, but upreared
Barbaric dwellings on their shattered site,
Which only make more mourned and more endeared
The few last rays of their far-scattered light,
And the crushed relics of their vanished might.
The Roman saw these tombs in his own age,
These sepulchres of cities, which excite
Sad wonder, and his yet surviving page
The moral lesson bears, drawn from such pilgrimage."
"Is it for fear to wet a widow’s eye,
That thou consum’st thyself in single life?
Ah! if thou issueless shalt hap to die,
The world will wail thee like a makeless wife;
The world will be thy widow and still weep
That thou no form of thee hast left behind,
When every private widow well may keep
By children’s eyes, her husband’s shape in mind:
Look! what an unthrift in the world doth spend
Shifts but his place, for still the world enjoys it;
But beauty’s waste hath in the world an end,
And kept unused the user so destroys it.
No love toward others in that bosom sits
That on himself such murd’rous shame commits."
"For shame! deny that thou bear’st love to any,
Who for thyself art so unprovident.
Grant, if thou wilt, thou art belov’d of many,
But that thou none lov’st is most evident:
For thou art so possess’d with murderous hate,
That ’gainst thyself thou stick’st not to conspire,
Seeking that beauteous roof to ruinate
Which to repair should be thy chief desire.
O! change thy thought, that I may change my mind:
Shall hate be fairer lodg’d than gentle love?
Be, as thy presence is, gracious and kind,
Or to thyself at least kind-hearted prove:
Make thee another self for love of me,
That beauty still may live in thine or thee."
"As fast as thou shalt wane, so fast thou grow’st,
In one of thine, from that which thou departest;
And that fresh blood which youngly thou bestow’st,
Thou mayst call thine when thou from youth convertest,
Herein lives wisdom, beauty, and increase;
Without this folly, age, and cold decay:
If all were minded so, the times should cease
And threescore year would make the world away.
Let those whom nature hath not made for store,
Harsh, featureless, and rude, barrenly perish:
Look, whom she best endow’d, she gave thee more;
Which bounteous gift thou shouldst in bounty cherish:
She carv’d thee for her seal, and meant thereby,
Thou shouldst print more, not let that copy die."
"When I do count the clock that tells the time,
And see the brave day sunk in hideous night;
When I behold the violet past prime,
And sable curls, all silvered o’er with white;
When lofty trees I see barren of leaves,
Which erst from heat did canopy the herd,
And summer’s green all girded up in sheaves,
Borne on the bier with white and bristly beard,
Then of thy beauty do I question make,
That thou among the wastes of time must go,
Since sweets and beauties do themselves forsake
And die as fast as they see others grow;
And nothing ’gainst Time’s scythe can make defence
Save breed, to brave him when he takes thee hence."
"Devouring Time, blunt thou the lion’s paws,
And make the earth devour her own sweet brood;
Pluck the keen teeth from the fierce tiger’s jaws,
And burn the long-liv’d phoenix, in her blood;
Make glad and sorry seasons as thou fleets,
And do whate’er thou wilt, swift-footed Time,
To the wide world and all her fading sweets;
But I forbid thee one most heinous crime:
O! carve not with thy hours my love’s fair brow,
Nor draw no lines there with thine antique pen;
Him in thy course untainted do allow
For beauty’s pattern to succeeding men.
Yet do thy worst, old Time; despite thy wrong,
My love shall in my verse ever live young."
"A woman’s face with nature’s own hand painted,
Hast thou, the master mistress of my passion;
A woman’s gentle heart, but not acquainted
With shifting change, as is false women’s fashion:
An eye more bright than theirs, less false in rolling,
Gilding the object whereupon it gazeth;
A man in hue all ‘hues’ in his controlling,
Which steals men’s eyes and women’s souls amazeth.
And for a woman wert thou first created;
Till Nature, as she wrought thee, fell a-doting,
And by addition me of thee defeated,
By adding one thing to my purpose nothing.
But since she prick’d thee out for women’s pleasure,
Mine be thy love and thy love’s use their treasure."
"As an unperfect actor on the stage,
Who with his fear is put beside his part,
Or some fierce thing replete with too much rage,
Whose strength’s abundance weakens his own heart;
So I, for fear of trust, forget to say
The perfect ceremony of love’s rite,
And in mine own love’s strength seem to decay,
O’ercharg’d with burthen of mine own love’s might.
O! let my looks be then the eloquence
And dumb presagers of my speaking breast,
Who plead for love, and look for recompense,
More than that tongue that more hath more express’d.
O! learn to read what silent love hath writ:
To hear with eyes belongs to love’s fine wit."
"Mine eye hath play’d the painter and hath stell’d,
Thy beauty’s form in table of my heart;
My body is the frame wherein ’tis held,
And perspective it is best painter’s art.
For through the painter must you see his skill,
To find where your true image pictur’d lies,
Which in my bosom’s shop is hanging still,
That hath his windows glazed with thine eyes.
Now see what good turns eyes for eyes have done:
Mine eyes have drawn thy shape, and thine for me
Are windows to my breast, where-through the sun
Delights to peep, to gaze therein on thee;
Yet eyes this cunning want to grace their art,
They draw but what they see, know not the heart."
"How can I then return in happy plight,
That am debarre’d the benefit of rest?
When day’s oppression is not eas’d by night,
But day by night and night by day oppress’d,
And each, though enemies to either’s reign,
Do in consent shake hands to torture me,
The one by toil, the other to complain
How far I toil, still farther off from thee.
I tell the day, to please him thou art bright,
And dost him grace when clouds do blot the heaven:
So flatter I the swart-complexion’d night,
When sparkling stars twire not thou gild’st the even.
But day doth daily draw my sorrows longer,
And night doth nightly make grief’s length seem stronger."
"When in disgrace with fortune and men’s eyes
I all alone beweep my outcast state,
And trouble deaf heaven with my bootless cries,
And look upon myself, and curse my fate,
Wishing me like to one more rich in hope,
Featur’d like him, like him with friends possess’d,
Desiring this man’s art, and that man’s scope,
With what I most enjoy contented least;
Yet in these thoughts my self almost despising,
Haply I think on thee, and then my state,
Like to the lark at break of day arising
From sullen earth, sings hymns at heaven’s gate;
For thy sweet love remember’d such wealth brings
That then I scorn to change my state with kings."
"Not that I love thy children, whose dull eyes
See nothing save their own unlovely woe,
Whose minds know nothing, nothing care to know,–
But that the roar of thy Democracies,
Thy reigns of Terror, thy great Anarchies,
Mirror my wildest passions like the sea
And give my rage a brother–!Liberty!
For this sake only do thy dissonant cries
Delight my discreet soul, else might all kings
By bloody knout or treacherous cannonades
Rob nations of their rights inviolate
And I remain unmoved–and yet, and yet,
These Christs that die upon the barricades,
God knows it I am with them, in some things."
"Milton! I think thy spirit hath passed away
From these white cliffs and high-embattled towers;
This gorgeous fiery-coloured world of ours
Seems fallen into ashes dull and grey,
And the age changed unto a mimic play
Wherein we waste our else too-crowded hours:
For all our pomp and pageantry and powers
We are but fit to delve the common clay,
Seeing this little isle on which we stand,
This England, this sea-lion of the sea,
By ignorant demagogues is held in fee,
Who love her not: Dear God! is this the land
Which bare a triple empire in her hand
When Cromwell spake the word Democracy!"
"Eagle of Austerlitz! where were thy wings
When far away upon a barbarous strand,
In fight unequal, by an obscure hand,
Fell the last scion of thy brood of Kings!

Poor boy! thou shalt not flaunt thy cloak of red,
Or ride in state through Paris in the van
Of thy returning legions, but instead
Thy mother France, free and republican,

Shall on thy dead and crownless forehead place
The better laurels of a soldier’s crown,
That not dishonoured should thy soul go down
To tell the mighty Sire of thy race

That France hath kissed the mouth of Liberty,
And found it sweeter than his honied bees,
And that the giant wave Democracy
Breaks on the shores where Kings lay couched at ease."
"Christ, dost Thou live indeed? or are Thy bones
Still straitened in their rock-hewn sepulchre?
And was Thy Rising only dreamed by her
Whose love of Thee for all her sin atones?
For here the air is horrid with men’s groans,
The priests who call upon Thy name are slain,
Dost Thou not hear the bitter wail of pain
From those whose children lie upon the stones?
Come down, O Son of God! incestuous gloom
Curtains the land, and through the starless night
Over Thy Cross a Crescent moon I see!
If Thou in very truth didst burst the tomb
Come down, O Son of Man! and show Thy might
Lest Mahomet be crowned instead of Thee!"
"There was a time in Europe long ago
When no man died for freedom anywhere,
But England’s lion leaping from its lair
Laid hands on the oppressor! it was so
While England could a great Republic show.
Witness the men of Piedmont, chiefest care
Of Cromwell, when with impotent despair
The Pontiff in his painted portico
Trembled before our stern ambassadors.
How comes it then that from such high estate
We have thus fallen, save that Luxury
With barren merchandise piles up the gate
Where noble thoughts and deeds should enter by:
Else might we still be Milton’s heritors."
"Tread lightly, she is near
Under the snow,
Speak gently, she can hear
The daisies grow.

All her bright golden hair
Tarnished with rust,
She that was young and fair
Fallen to dust.

Lily-like, white as snow,
She hardly knew
She was a woman, so
Sweetly she grew.

Coffin-board, heavy stone,
Lie on her breast,
I vex my heart alone,
She is at rest.

Peace, Peace, she cannot hear
Lyre or sonnet,
All my life’s buried here,
Heap earth upon it.

Avignon."
"See, I have climbed the mountain side
Up to this holy house of God,
Where once that Angel-Painter trod
Who saw the heavens opened wide,

And throned upon the crescent moon
The Virginal white Queen of Grace,–
Mary! could I but see thy face
Death could not come at all too soon.

O crowned by God with thorns and pain!
Mother of Christ!O mystic wife!
My heart is weary of this life
And over-sad to sing again.

O crowned by God with love and flame!
O crowned by Christ the Holy One!
O listen ere the searching sun
Show to the world my sin and shame."
"Italia! thou art fallen, though with sheen
Of battle-spears thy clamorous armies stride
From the north Alps to the Sicilian tide!
Ay! fallen, though the nations hail thee Queen
Because rich gold in every town is seen,
And on thy sapphire-lake in tossing pride
Of wind-filled vans thy myriad galleys ride
Beneath one flag of red and white and green.
O Fair and Strong!O Strong and Fair in vain!
Look southward where Rome’s desecrated town
Lies mourning for her God-anointed King!
Look heaven-ward! shall God allow this thing?
Nay! but some flame-girt Raphael shall come down,
And smite the Spoiler with the sword of pain."
"Rome! what a scroll of History thine has been;
In the first days thy sword republican
Ruled the whole world for many an age’s span:
Then of the peoples wert thou royal Queen,
Till in thy streets the bearded Goth was seen;
And now upon thy walls the breezes fan
(Ah, city crowned by God, discrowned by man!)
The hated flag of red and white and green.
When was thy glory! when in search for power
Thine eagles flew to greet the double sun,
And the wild nations shuddered at thy rod?
Nay, but thy glory tarried for this hour,
When pilgrims kneel before the Holy One,
The prisoned shepherd of the Church of God."
